{
  "schema_version": "1.0.0",
  "source_path": "data/staging/animation_curation_run_keyposes_20260903/run_flight_push_hypothesis2_visual_producer_output.png",
  "source_class": "high_res_full_body_character",
  "intended_role": "translation_source",
  "matte_policy": "border_connected",
  "reviewer": "agent_visual_triage",
  "identity_authority_path": "data/source_art/r1/r1-01/concept.png",
  "identity_authority_sha256": "591d310623aaf37426af1cb846a715c1fd88e905163364d64565278ed31303cd",
  "visual_source_of_truth_contract": "data/source_art/r1/r1_delivery_manifest.json",
  "derivation": "independent image producer output referenced to R1; no v04-v09 pixels, crop, resize, quantization, or img2img source reused",
  "observations": {
    "baked_checkerboard": false,
    "ground_shadow": "absent",
    "dust_or_particles": "absent",
    "smoke_or_clouds": "absent",
    "floor_line": "absent",
    "text_or_annotation": "absent",
    "multiple_overlapping_poses": false,
    "cropped_extremities": false,
    "occluded_identity_features": false,
    "motion_blur": false,
    "background_color_collision": false,
    "notes": "Single right-facing extended airborne stride; separated shoes and no ground shadow."
  }
}
